Title,Author,Real Price,Sale Price,IsOnSale,Category,Retrieved At,Discount (%)
Фаворити, Лејн Фарго,590.0,0.0,False,Романси,2025-05-02,0.0
Тунел, Ана Волц,400.0,0.0,False,Романси,2025-05-02,0.0
Љубов во Рим, Сара Адамс,490.0,0.0,False,Романси,2025-05-02,0.0
Шпанска љубовна измама, Елена Армас,590.0,0.0,False,Романси,2025-05-02,0.0
Изопачени лаги, Ана Хуанг,590.0,0.0,False,Романси,2025-05-02,0.0
Убавината на скршените нешта, Ивана Спасев,390.0,0.0,False,Романси,2025-05-02,0.0
Твој Толак, Торе Ренберг,370.0,0.0,False,Романси,2025-05-02,0.0
За нас (Браќата Бејли #2), Клер Кингсли,550.0,0.0,False,Романси,2025-05-02,0.0
Завеани за Божиќ, Сара Морган,490.0,0.0,False,Романси,2025-05-02,0.0
Божиќниот клуб на читатели, Сара Морган,490.0,0.0,False,Романси,2025-05-02,0.0
Бессони во Менхетен, Вај Киленд,450.0,0.0,False,Романси,2025-05-02,0.0
Како намќорот го спаси Божиќ, Клер Кингсли,470.0,0.0,False,Романси,2025-05-02,0.0
За тебе (Браќата Бејли #1), Клер Кингсли,390.0,0.0,False,Романси,2025-05-02,0.0
Љубов на втор поглед, Меган Квин,590.0,0.0,False,Романси,2025-05-02,0.0
ВРАЌАЊЕ, Али Мартинез,450.0,0.0,False,Романси,2025-05-02,0.0
Невидлива убавина, Ејми Хармон,450.0,0.0,False,Романси,2025-05-02,0.0
Деновите кога најмногу те љубев, Ејми Неф,490.0,0.0,False,Романси,2025-05-02,0.0
Првата вечерна ѕвезда, Сузан Е. Филипс,440.0,0.0,False,Романси,2025-05-02,0.0
Изопачена омраза, Ана Хуанг,500.0,0.0,False,Романси,2025-05-02,0.0
"На господин Филип, со љубов (Бриџертон #5)", Џулија Квин,520.0,0.0,False,Романси,2025-05-02,0.0
Венчани до изгрејсонце (Хатавеј #4), Лиса Клејпас,470.0,349.0,True,Романси,2025-05-02,26.0
Кафеноока (Тревис #4), Лиса Клејпас,450.0,0.0,False,Романси,2025-05-02,0.0
Со секој здив, Николас Спаркс,450.0,0.0,False,Романси,2025-05-02,0.0
Договор за љубов (Dreamland Billionaires #2), Лорен Ашер,490.0,0.0,False,Романси,2025-05-02,0.0
Љубов во Тел Авив, Сандра Малетски,370.0,0.0,False,Романси,2025-05-02,0.0
Романса со господин Бриџертон (Бриџертон #4), Џулија Квин,520.0,0.0,False,Романси,2025-05-02,0.0
Беспрекорно, Елси Силвер,520.0,0.0,False,Романси,2025-05-02,0.0
Безобразни писма, Вај Киленд,450.0,0.0,False,Романси,2025-05-02,0.0
Шепотот на судбината, Ана Антовска,390.0,0.0,False,Романси,2025-05-02,0.0
Кралицата Шарлота," Џулија Квин, Шонда Рајмс,",520.0,0.0,False,Романси,2025-05-02,0.0
Скрши го мразот, Хана Грејс,590.0,0.0,False,Романси,2025-05-02,0.0
Ривалите, Вај Киленд,450.0,0.0,False,Романси,2025-05-02,0.0
Види ме, Николас Спаркс,590.0,0.0,False,Романси,2025-05-02,0.0
Свадба во декември, Сара Морган,490.0,0.0,False,Романси,2025-05-02,0.0
КУМ, Саша Богдан,300.0,0.0,False,Романси,2025-05-02,0.0
Плејбој, Вај Киленд,450.0,0.0,False,Романси,2025-05-02,0.0
Изопачени игри, Ана Хуанг,470.0,0.0,False,Романси,2025-05-02,0.0
Сите недовршени нешта, Ребека Јарос,590.0,0.0,False,Романси,2025-05-02,0.0
Последната желба, Николас Спаркс,550.0,0.0,False,Романси,2025-05-02,0.0
Длабоко под површината, Памела Клер,420.0,0.0,False,Романси,2025-05-02,0.0
Фустанот и Светец, Колин Хувер,350.0,0.0,False,Романси,2025-05-02,0.0
Последното писмо, Ребека Јарос,590.0,0.0,False,Романси,2025-05-02,0.0
Статистичка веројатност за љубов на прв поглед, Џенифер И. Смит,390.0,0.0,False,Романси,2025-05-02,0.0
Танцувај со мене, Сузан Е. Филипс,520.0,0.0,False,Романси,2025-05-02,0.0
Домашен фронт, Кристин Хана,550.0,0.0,False,Романси,2025-05-02,0.0
ОСЛОБОДУВАЊЕ, Али Мартинез,450.0,0.0,False,Романси,2025-05-02,0.0
Прекрасна грешка, Вај Киленд,450.0,0.0,False,Романси,2025-05-02,0.0
ИГРАЧОТ, Вај Киленд,450.0,0.0,False,Романси,2025-05-02,0.0
Изопачена љубов, Ана Хуанг,450.0,0.0,False,Романси,2025-05-02,0.0
ПОГОДОКОТ #3, Ел Кенеди,450.0,0.0,False,Романси,2025-05-02,0.0
Најслаткиот филџан кафе, Оља Петрушевска – Томева,320.0,0.0,False,Романси,2025-05-02,0.0
Книгољупци, Емили Хенри,550.0,0.0,False,Романси,2025-05-02,0.0
Љубов меѓу редови (Dreamland Billionaires #1), Лорен Ашер,490.0,0.0,False,Романси,2025-05-02,0.0
Бадникова вечер во Фрајдеј Харбор (Фрајдеј Харбор #1), Лиса Клејпас,390.0,0.0,False,Романси,2025-05-02,0.0
Понуда од џентлмен (Бриџертон #3), Џулија Квин,450.0,0.0,False,Романси,2025-05-02,0.0
Грешката (Off-Campus #2), Ел Кенеди,450.0,0.0,False,Романси,2025-05-02,0.0
Божиќ во Шкотска, Сара Морган,490.0,0.0,False,Романси,2025-05-02,0.0
На работ, Памела Клер,490.0,0.0,False,Романси,2025-05-02,0.0
Намами ме во самрак (Хатавеј #3), Лиса Клејпас,450.0,0.0,False,Романси,2025-05-02,0.0
Ова започнува со нас, Колин Хувер,520.0,0.0,False,Романси,2025-05-02,0.0
Поканата, Вај Киленд,450.0,0.0,False,Романси,2025-05-02,0.0
Заведи ме в мугри (Хатавеј #2), Лиса Клејпас,450.0,0.0,False,Романси,2025-05-02,0.0
Шах мат, Р.Л Метјусон,440.0,0.0,False,Романси,2025-05-02,0.0
Еднаш и засекогаш, Џудит МекНот,490.0,0.0,False,Романси,2025-05-02,0.0
Предоцна, Колин Хувер,490.0,0.0,False,Романси,2025-05-02,0.0
Совршен допир, Ана Антовска,350.0,0.0,False,Романси,2025-05-02,0.0
Договорот (Off-Campus #1), Ел Кенеди,450.0,0.0,False,Романси,2025-05-02,0.0
Забранет допир, Памела Клер,450.0,0.0,False,Романси,2025-05-02,0.0
Совршенство, Р.Л Метјусон,440.0,0.0,False,Романси,2025-05-02,0.0
Татјана и Александар II: Мостот Кон Светиот Крст, Паулина Сајмонс,500.0,0.0,False,Романси,2025-05-02,0.0
Со љубов од Лондон, Сара Џио,490.0,0.0,False,Романси,2025-05-02,0.0
Сите ја сакаат Марта, Мирјана Проданова,320.0,0.0,False,Романси,2025-05-02,0.0
Коронтин, Саша Богдан,300.0,0.0,False,Романси,2025-05-02,0.0
Егоманијак, Вај Киленд,450.0,0.0,False,Романси,2025-05-02,0.0
Луѓето кои ги среќаваме на одмор, Емили Хенри,450.0,0.0,False,Романси,2025-05-02,0.0
Татјана и Александар I: Втората Америка, Паулина Сајмонс,500.0,0.0,False,Романси,2025-05-02,0.0
Жртвување со оган, Лепа Гештаковска Христовска,300.0,0.0,False,Романси,2025-05-02,0.0
Закопана вистина, Далибор Трајков,300.0,0.0,False,Романси,2025-05-02,0.0
Споменот на него, Колин Хувер,490.0,0.0,False,Романси,2025-05-02,0.0
Можеби сега, Колин Хувер,420.0,0.0,False,Романси,2025-05-02,0.0
Моја до полноќ (Хатавеј #1), Лиса Клејпас,440.0,0.0,False,Романси,2025-05-02,0.0
Умри за мене, Синтија Идн,450.0,225.0,True,Романси,2025-05-02,50.0
Жената со сина ѕвезда, Пам Џеноф,450.0,0.0,False,Романси,2025-05-02,0.0
Здравица, Саша Богдан,250.0,0.0,False,Романси,2025-05-02,0.0
Господин Неподнослив, Вај Киленд,420.0,0.0,False,Романси,2025-05-02,0.0
Улицата на бродовите, Сара Џио,450.0,0.0,False,Романси,2025-05-02,0.0
Ова завршува со нас (тврд повез), Колин Хувер,500.0,0.0,False,Романси,2025-05-02,0.0
Коски на срцето (тврд повез), Колин Хувер,550.0,0.0,False,Романси,2025-05-02,0.0
Додека има ѕвезди, Сара Џио,490.0,0.0,False,Романси,2025-05-02,0.0
Присестра, Џенифер Донели,450.0,0.0,False,Романси,2025-05-02,0.0
Од жарјето, Али Мартинез,420.0,0.0,False,Романси,2025-05-02,0.0
Во војната и љубовта, Верица Митева,300.0,0.0,False,Романси,2025-05-02,0.0
Можеби овој Божиќ (Браќата О’Нил #3), Сара Морган,420.0,0.0,False,Романси,2025-05-02,0.0
Виконтот кој ме сакаше (Бриџертон #2), Џулија Квин,450.0,0.0,False,Романси,2025-05-02,0.0
Господин вообразен, Вај Киленд,420.0,0.0,False,Романси,2025-05-02,0.0
Херој, Саманта Јанг,420.0,0.0,False,Романси,2025-05-02,0.0
Летото смени сѐ (Браќата О’Нил #2), Сара Морган,420.0,0.0,False,Романси,2025-05-02,0.0
Шефот од соништата, Вај Киленд,420.0,0.0,False,Романси,2025-05-02,0.0
Ѕвончиња во снегот (Браќата О’Нил #1), Сара Морган,420.0,0.0,False,Романси,2025-05-02,0.0
Војводата и јас (Бриџертон #1), Џулија Квин,450.0,0.0,False,Романси,2025-05-02,0.0
Слаткоречив туѓинец (Тревис #3), Лиса Клејпас,420.0,0.0,False,Романси,2025-05-02,0.0
"Страст, предавства и оние два збора", Маја Божиновска,350.0,0.0,False,Романси,2025-05-02,0.0
Искра надеж,,490.0,0.0,False,Романси,2025-05-02,0.0
Што знае ветрот,,490.0,0.0,False,Романси,2025-05-02,0.0
Љубовно романче, Емили Хенри,420.0,0.0,False,Романси,2025-05-02,0.0
Еден незаборавен Божиќ (Wallflowers #5), Лиса Клејпас,390.0,0.0,False,Романси,2025-05-02,0.0
Коски на срцето, Колин Хувер,440.0,0.0,False,Романси,2025-05-02,0.0
"Очи од сребро, очи од злато",,490.0,0.0,False,Романси,2025-05-02,0.0
Јужњакот со сини очи (Тревис #2), Лиса Клејпас,420.0,0.0,False,Романси,2025-05-02,0.0
Ти си тој што го сакам, Џована Флечер,400.0,0.0,False,Романси,2025-05-02,0.0
Јас и ти, Кристан Хигинс,420.0,0.0,False,Романси,2025-05-02,0.0
Последната камелија, Сара Џио,420.0,0.0,False,Романси,2025-05-02,0.0
Совршена недомаќинка, Софи Кинсела,420.0,0.0,False,Романси,2025-05-02,0.0
Избриши ги солзите,,450.0,0.0,False,Романси,2025-05-02,0.0
Скандал на пролет (Wallflowers #4), Лиса Клејпас,420.0,0.0,False,Романси,2025-05-02,0.0
Вистинскиот за мене,,420.0,0.0,False,Романси,2025-05-02,0.0
Светот не е фабрика за исполнување желби, Џон Грин,380.0,0.0,False,Романси,2025-05-02,0.0
Напишано со тебе (Regret duet #2), Али Мартинез,420.0,0.0,False,Романси,2025-05-02,0.0
Девојка од мал град (Тревис #1), Лиса Клејпас,420.0,0.0,False,Романси,2025-05-02,0.0
Напишано со каење (Regret duet #1), Али Мартинез,420.0,0.0,False,Романси,2025-05-02,0.0
Без каење, Колин Хувер,440.0,0.0,False,Романси,2025-05-02,0.0
Нечесна игра, Верица Митева,300.0,0.0,False,Романси,2025-05-02,0.0
Една страшна зима (Wallflowers #3), Лиса Клејпас,420.0,0.0,False,Романси,2025-05-02,0.0
Сурова љубов, Колин Хувер,400.0,0.0,False,Романси,2025-05-02,0.0
Најсветлото зајдисонце, Али Мартинез,390.0,0.0,False,Романси,2025-05-02,0.0
Најмрачното изгрејсонце, Али Мартинез,390.0,0.0,False,Романси,2025-05-02,0.0
Се случи една есен (Wallflowers #2), Лиса Клејпас,420.0,0.0,False,Романси,2025-05-02,0.0
Доказ за љубов, Памела Клер,400.0,0.0,False,Романси,2025-05-02,0.0
"Флерт, уцени и високи потпетици", Маја Божиновска,350.0,0.0,False,Романси,2025-05-02,0.0
Маријана, Сузана Кирсли,420.0,0.0,False,Романси,2025-05-02,0.0
Тајни на летната ноќ (Wallflowers #1), Лиса Клејпас,420.0,0.0,False,Романси,2025-05-02,0.0
Ленинградска зима, Кристин Хана,420.0,0.0,False,Романси,2025-05-02,0.0
Знаеш ли да чуваш тајна?, Софи Кинсела,420.0,0.0,False,Романси,2025-05-02,0.0
Песната на речните птици, Лиса Вингејт,450.0,0.0,False,Романси,2025-05-02,0.0
Сите твои совршености, Колин Хувер,400.0,0.0,False,Романси,2025-05-02,0.0
"Будалеста, слатка љубов #3", Џил Шелвис,390.0,0.0,False,Романси,2025-05-02,0.0
Најслаткото нешто #2, Џил Шелвис,390.0,0.0,False,Романси,2025-05-02,0.0
Moјот (не баш) совршен живот, Софи Кинсела,420.0,0.0,False,Романси,2025-05-02,0.0
Слатки мали тајни #1, Џил Шелвис,390.0,0.0,False,Романси,2025-05-02,0.0
Тајната колиба на плажата, Сара Џио,400.0,0.0,False,Романси,2025-05-02,0.0
Го имам твојот број, Софи Кинсела,420.0,0.0,False,Романси,2025-05-02,0.0
Светлината што ја изгубивме, Џил Сантополо,400.0,0.0,False,Романси,2025-05-02,0.0
Синдер & Ела, Кели Орам,390.0,0.0,False,Романси,2025-05-02,0.0
Еленор Олифант е океј, Гејл Ханимен,400.0,0.0,False,Романси,2025-05-02,0.0
Темјанушки во март, Сара Џио,400.0,0.0,False,Романси,2025-05-02,0.0
Живот за живот, Сара Зар,380.0,0.0,False,Романси,2025-05-02,0.0
Тајната сопруга, Џил Пол,450.0,0.0,False,Романси,2025-05-02,0.0
Зима со мирис на капини, Сара Џио,400.0,0.0,False,Романси,2025-05-02,0.0
Точка на кулминација, Памела Клер,390.0,0.0,False,Романси,2025-05-02,0.0
Онаа ноќ во Њујорк, Лорен Лејн,390.0,0.0,False,Романси,2025-05-02,0.0
На улица Шкотска, Саманта Јанг,390.0,0.0,False,Романси,2025-05-02,0.0
Кралство од соништата, Џудит МекНот,400.0,0.0,False,Романси,2025-05-02,0.0
Ќе има друг ден, Лори Нелсон Спилмен,390.0,0.0,False,Романси,2025-05-02,0.0
Крововите на Техеран, Махбод Сераџи,390.0,0.0,False,Романси,2025-05-02,0.0
Една од момците, Лорен Лејн,390.0,0.0,False,Романси,2025-05-02,0.0
Кога сакаш некого, Кристин Хана,420.0,0.0,False,Романси,2025-05-02,0.0
Ти не знаеш да сакаш, Сузан Е. Филипс,390.0,0.0,False,Романси,2025-05-02,0.0
"Или ти, или никој", Сузан Е. Филипс,390.0,0.0,False,Романси,2025-05-02,0.0
Тајна задача: љубов, Џули Џејмс,390.0,0.0,False,Романси,2025-05-02,0.0
Улица Индија, Саманта Јанг,390.0,0.0,False,Романси,2025-05-02,0.0
Проблемот со бившите, Лорен Лејн,390.0,0.0,False,Романси,2025-05-02,0.0
Ова завршува со нас, Колин Хувер,400.0,0.0,False,Романси,2025-05-02,0.0
"Тој рече, таа рече", Лорен Лејн,390.0,0.0,False,Романси,2025-05-02,0.0
Господин Неодолив, Сузан Е. Филипс,390.0,0.0,False,Романси,2025-05-02,0.0
А што по бакнежот?, Лорен Лејн,390.0,0.0,False,Романси,2025-05-02,0.0
9 Ноември, Колин Хувер,380.0,0.0,False,Романси,2025-05-02,0.0
Збогум најмила, Кристин Хана,420.0,0.0,False,Романси,2025-05-02,0.0
Славејот, Кристин Хана,420.0,0.0,False,Романси,2025-05-02,0.0
Само најсекси маж кој постои, Џули Џејмс,420.0,0.0,False,Романси,2025-05-02,0.0
Нека победи подобриот, Џули Џејмс,420.0,0.0,False,Романси,2025-05-02,0.0
Мојот личен ФБИ агент, Џули Џејмс,420.0,0.0,False,Романси,2025-05-02,0.0
Перфектна хемија, Симон Елкелс,380.0,0.0,False,Романси,2025-05-02,0.0
Нешто слично на љубов, Џули Џејмс,390.0,0.0,False,Романси,2025-05-02,0.0
Првиот последен бакнеж, Али Харис,390.0,0.0,False,Романси,2025-05-02,0.0
Подарок за роденден, Сузан Е. Филипс,390.0,0.0,False,Романси,2025-05-02,0.0
Сосед од пеколот, Р.Л Метјусон,380.0,0.0,False,Романси,2025-05-02,0.0
Во врска со онаа ноќ, Џули Џејмс,390.0,0.0,False,Романси,2025-05-02,0.0
Сонувај малку, Сузан Е. Филипс,390.0,0.0,False,Романси,2025-05-02,0.0
Тајната на сопругот, Лиен Мориарти,390.0,0.0,False,Романси,2025-05-02,0.0
Само пријатели, Колин Хувер,350.0,0.0,False,Романси,2025-05-02,0.0
На улица Даблин, Саманта Јанг,420.0,0.0,False,Романси,2025-05-02,0.0
Нешто сино, Емили Гифин,390.0,0.0,False,Романси,2025-05-02,0.0
Го сакам Лондон, Линдзи Келк,380.0,0.0,False,Романси,2025-05-02,0.0
Совршено несовршен пар, Сузан Е. Филипс,390.0,0.0,False,Романси,2025-05-02,0.0
На една свадба, Џули Џејмс,390.0,0.0,False,Романси,2025-05-02,0.0
Една неодолива љубов, Џули Џејмс,390.0,0.0,False,Романси,2025-05-02,0.0
И одеднаш едно лето, Џули Џејмс,390.0,0.0,False,Романси,2025-05-02,0.0
Големи мали лаги, Лиен Мориарти,400.0,0.0,False,Романси,2025-05-02,0.0
Кога мене ќе ме нема, Колин Оукли,400.0,0.0,False,Романси,2025-05-02,0.0
Еленор и Парк, Реинбоу Ровел,380.0,0.0,False,Романси,2025-05-02,0.0
Можеби никогаш, Колин Хувер,250.0,0.0,False,Романси,2025-05-02,0.0
Можеби некогаш, Колин Хувер,380.0,0.0,False,Романси,2025-05-02,0.0
Старомодниот водич за љубов и романса, Кирсти Гринвуд,390.0,0.0,False,Романси,2025-05-02,0.0
Ова мое срце, Сузан Е. Филипс,390.0,0.0,False,Романси,2025-05-02,0.0
Пред улица Јамајка, Саманта Јанг,390.0,0.0,False,Романси,2025-05-02,0.0
Софи и Картер,,250.0,0.0,False,Романси,2025-05-02,0.0
Планот за среќен крај, Линдзи Келк,390.0,0.0,False,Романси,2025-05-02,0.0
"Сè, баш сè", Никола Јун,380.0,0.0,False,Романси,2025-05-02,0.0
Прошетка по облаците, Ева Мари Еверсон,380.0,0.0,False,Романси,2025-05-02,0.0
Го сакам Њујорк, Линдзи Келк,390.0,0.0,False,Романси,2025-05-02,0.0
Од љубов до омраза, Кристан Хигинс,390.0,0.0,False,Романси,2025-05-02,0.0
Нешто позајмено, Емили Гифин,390.0,0.0,False,Романси,2025-05-02,0.0
По улица Лондон, Саманта Јанг,390.0,0.0,False,Романси,2025-05-02,0.0
Во потрага по Алјаска, Џон Грин,370.0,0.0,False,Романси,2025-05-02,0.0
Го сакам Вегас, Линдзи Келк,380.0,0.0,False,Романси,2025-05-02,0.0
Рајот може да почека, Кели Тејлор,360.0,0.0,False,Романси,2025-05-02,0.0
Божиќ засекогаш,,500.0,0.0,False,Романси,2025-05-02,0.0
Остров на тишината,,400.0,0.0,False,Романси,2025-05-02,0.0
Возбудливи времиња,,450.0,0.0,False,Романси,2025-05-02,0.0
Список за читање,,490.0,0.0,False,Романси,2025-05-02,0.0
Војна и љубов,,520.0,0.0,False,Романси,2025-05-02,0.0
Ќерката на трговецот со свила,,500.0,0.0,False,Романси,2025-05-02,0.0
Кери Сото се врати,,490.0,0.0,False,Романси,2025-05-02,0.0
Сликата што не е на продажба,,400.0,0.0,False,Романси,2025-05-02,0.0
Италијанската девојка,,630.0,0.0,False,Романси,2025-05-02,0.0
Твојата вина,,599.0,0.0,False,Романси,2025-05-02,0.0
Мојата вина,,599.0,0.0,False,Романси,2025-05-02,0.0
Рецептот за надеж,,490.0,0.0,False,Романси,2025-05-02,0.0
Првиот ден од остаток на твојот живот,,450.0,0.0,False,Романси,2025-05-02,0.0
Крадецот на сенки,,430.0,0.0,False,Романси,2025-05-02,0.0
Се поради еден допир,,430.0,0.0,False,Романси,2025-05-02,0.0
Лејла,,420.0,0.0,False,Романси,2025-05-02,0.0
Подарок за сеќавање,,430.0,0.0,False,Романси,2025-05-02,0.0
Болка во џебот,,250.0,0.0,False,Романси,2025-05-02,0.0
Скандалозни страсти,,430.0,0.0,False,Романси,2025-05-02,0.0
Тоа бевме ние,,300.0,0.0,False,Романси,2025-05-02,0.0
Последната годишнина,,490.0,0.0,False,Романси,2025-05-02,0.0
Се поради еден бакнеж,,430.0,0.0,False,Романси,2025-05-02,0.0
Ќе се најдеме во Бомбај,,490.0,0.0,False,Романси,2025-05-02,0.0
Љубовна Хипотеза,,500.0,0.0,False,Романси,2025-05-02,0.0
Љубовни неврони,,500.0,0.0,False,Романси,2025-05-02,0.0
Фатени во љубовна мрежа,,500.0,0.0,False,Романси,2025-05-02,0.0
Патеката на слоновите,,430.0,0.0,False,Романси,2025-05-02,0.0
Едно лето во Италија,,420.0,0.0,False,Романси,2025-05-02,0.0
Покорувајќи го војводата,,500.0,0.0,False,Романси,2025-05-02,0.0
Сите лета потоа,,500.0,0.0,False,Романси,2025-05-02,0.0
Љубовта не гори во пожар,,430.0,0.0,False,Романси,2025-05-02,0.0
Хамнет,,420.0,0.0,False,Романси,2025-05-02,0.0
Хотел меѓу две војни,,420.0,0.0,False,Романси,2025-05-02,0.0
Авантурите на лошото девојче,,500.0,0.0,False,Романси,2025-05-02,0.0
Позајмени сништа,,300.0,0.0,False,Романси,2025-05-02,0.0
Една од оние ноќи во Малибу,,350.0,0.0,False,Романси,2025-05-02,0.0
Писатели и љубовници,,360.0,0.0,False,Романси,2025-05-02,0.0
Се што чуваме,,330.0,0.0,False,Романси,2025-05-02,0.0
Се што даваме,,390.0,0.0,False,Романси,2025-05-02,0.0
Двајца во едно срце,,430.0,0.0,False,Романси,2025-05-02,0.0
Седумте мажи на Евелин Хуго,,450.0,0.0,False,Романси,2025-05-02,0.0
Се што сакам за Божиќ,,430.0,0.0,False,Романси,2025-05-02,0.0
Крај за паметење,,430.0,0.0,False,Романси,2025-05-02,0.0
Се поради една љубов,,430.0,0.0,False,Романси,2025-05-02,0.0
28 лета,,500.0,0.0,False,Романси,2025-05-02,0.0
СЕ СЛУЧИ ЕДНО ЛЕТО,,500.0,0.0,False,Романси,2025-05-02,0.0
Се поради еден војвода,,430.0,0.0,False,Романси,2025-05-02,0.0
